,noticia,verdadeira,url
3065,"Foto mostra jovem com o rosto inchado. A legenda alega que ele foi voluntário do Coronavac, uma vacina chinesa contra ao COVID-19 sendo testada no Brasil.",1,https://piaui.folha.uol.com.br/lupa/2020/07/28/verificamos-voluntario-vacina-efeitos-colaterais/
3066,"A hidroxicloroquina trabalha contra a COVID-19, segundo a médica Stella Immanuel.",1,https://piaui.folha.uol.com.br/lupa/2020/07/29/verificamos-hidroxicloroquina-video-medica-eua/
3067,A OMS voltou atrás e agora defende que todas as economias sejam reabertas imediatamente.,1,https://piaui.folha.uol.com.br/lupa/2020/07/29/verificamos-oms-nao-recuou-economia/
3068,"Ziraldo, cartunista brasileiro, afirmou que todos os prefeitos que decretaram lockdown não serão reeleitos.",1,https://piaui.folha.uol.com.br/lupa/2020/07/30/verificamos-ziraldo-prefeito-lockdown/
3069,"As Lojas Americanas, varejista brasileira, está oferecendo cartões-presente gratuitos para famílias afetadas pela pandemia.",1,https://piaui.folha.uol.com.br/lupa/2020/07/31/verificamos-lojas-americanas-pandemia/
3070,"Eduardo Leite, governador do Rio Grande do Sul, está tomando hidroxicloroquina e ivermectina contra a COVID-19.",1,https://piaui.folha.uol.com.br/lupa/2020/07/31/verificamos-governador-rs-hidroxicloroquina/
3071,"Uma receita de hidroxicloroquina, azitromicina e zinco garante a cura de 99,9% de qualquer paciente com COVID-19.",1,https://piaui.folha.uol.com.br/lupa/2020/07/31/verificamos-coquetel-hidroxicloroquina/
3072,Voluntário brasileiro para tomar a vacina CoronaVac relatou dor e febre no corpo após a vacinação.,1,https://www.aosfatos.org/noticias/voluntaria-que-relatou-febre-e-mal-estar-nao-participou-de-testes-da-coronavac/
3073,A vacina CoronaVac usa células de fetos abortados.,1,https://www.aosfatos.org/noticias/e-falso-que-coronavac-usa-celulas-de-bebes-abortados/
3074,Foto de homem com rosto inchado mostra efeito colateral do CoronaVac em voluntário brasileiro.,1,https://www.aosfatos.org/noticias/foto-de-homem-com-rosto-inchado-nao-retrata-efeito-colateral-da-coronavac/
3075,Máscaras de proteção reduzem o nível de oxigênio no sangue.,1,https://www.aosfatos.org/noticias/nao-e-verdade-que-uso-de-mascara-reduz-nivel-de-oxigenio-no-sangue/
3076,A cloroquina é a cura para a COVID-19 e as máscaras não devem ser usadas.,1,https://www.aosfatos.org/noticias/em-video-difundido-por-trump-medica-engana-ao-dizer-que-cloroquina-cura-covid19/
3077,Prefeituras brasileiras recebem R$ 19 mil em financiamento federal por cada morte por COVID-19 registrada.,1,https://www.aosfatos.org/noticias/prefeituras-nao-recebem-r-19-mil-do-governo-federal-cada-morte-por-covid-19/
3078,Estudo da Coréia do Sul considera quarentenas inúteis no combate à COVID-19.,1,https://www.aosfatos.org/noticias/estudo-coreano-nao-concluiu-que-distanciamento-social-e-inutil-contra-covid-19/
3079,Foto mostra protesto contra medidas de combate à COVID-19 em Berlim.,1,https://www.aosfatos.org/noticias/foto-de-festival-na-suica-em-2018-e-atribuida-nas-redes-protesto-contra-isolamento-na-alemanha/
3080,"O governo de Maduro acusa de ""bioterroristas"" a migrantes venezuelanos que retornaram ao país.",1,https://cotejo.info/2020/07/maduro-migrantes-venezolanos-retornados-bioterroristas/
3082,"Imagem de crianças em Serra Leoa com paralisia das pernas como resultado de ""testes de vacinação"",""Falso",1,Curas
3083,"Um vídeo de médicos franceses jogando seus chalecos em protesto contra ""a falsa pandemia"",""Dúbio ",1,Outros
3084,A inalação de eucalipto evita e elimina o novo coronavírus,1,https://www.newtral.es/inhalar-eucalipto-no-previene-ni-elimina-el-nuevo-coronavirus/20200721/
3085,O presidente de Gana adere às teorias da conspiração sobre a origem da pandemia,1,https://www.newtral.es/bulo-presidente-ghana-teorias-conspirativas-covid/20200721/
3086,Membros do Podemos se viraram em cerimônia do Estado,1,https://www.newtral.es/es-falso-que-miembros-de-podemos-se-dieran-la-vuelta-en-la-ceremonia-de-estado-echo/20200717/
3087,Adidas está doando máscaras de presente,1,https://www.newtral.es/bulo-adidas-regala-mascarillas-phishing/20200710/
3088,Vídeo de um homem usando um monitor de ar para demonstrar que usar uma máscara provoca falta de oxigênio,1,https://www.newtral.es/video-monitor-aire-mascarilla-falta-oxigeno/20200709/
3089,A banana bloqueia “a entrada celular da Covid-19”,1,https://www.newtral.es/bulo-platano-bloquea-entrada-covid-19/20200706/
3090,"Um vídeo mostrando a recomendação de um suposto médico conhecido como Doutor Panay, que aconselha tomar ivermectina porque, segundo ele, mata o novo coronavírus em 48 horas",1,https://lasillavacia.com/detector-no-hoy-no-se-ha-probado-ivermectina-cure-covid-19-77654
3091,Uma publicação que garante que os assintomáticos são imunes e não espalham o vírus,1,https://lasillavacia.com/detector-no-ser-asintomatico-no-significa-ser-inmune-al-covid-77659
3092,"Um áudio de uma entrevista do programa “Nocturna” da RCN Radio com o médico Raúl Salazar Restrepo, na qual ele garante que os respiradores não são necessários e que a quarentena pode terminar com um tratamento que vale menos de $30 mil em uma farmácia",1,https://lasillavacia.com/detector-recomendacion-enganosa-raul-salazar-covid-77677
3093,Folhas de goiabeira previnem e revertem o novo coronavírus,1,https://www.animalpolitico.com/elsabueso/hojas-guayaba-pruebas-prevenir-covid/
3094,Imagens de um navio que pegou fogo quando transportava hospitais de campanha,1,https://www.animalpolitico.com/elsabueso/barco-hospitales-incendio-india/
3095,Vídeo de um médico batendo em um paciente com Covid-19,1,https://www.animalpolitico.com/elsabueso/falso-video-medico-golpea-paciente-covid/
3096,"Uma publicação que garante que a pandemia não tem base científica e que os testes de PCR ""não podem detectar a Covid-19"".",1,https://www.animalpolitico.com/elsabueso/una-publicacion-comparte-datos-falsos-sobre-la-pandemia-de-covid/
3097,Postagens no Facebook alegando que a Organização Mundial da Saúde (OMS) está questionando a eficácia do confinamento em todo o mundo,1,https://animal.mx/2020/07/falso-oms-confinamiento-asintomaticos/
3098,Inalar álcool cura a Covid-19,1,https://www.animalpolitico.com/elsabueso/inhalar-alcohol-no-cura-covid/
3099,"O governador de Jujuy (Argentina), Gerardo Morales: ""na Região Metropolitana [de Buenos Aires] 20% dos infectados são profissionais de saúde"",""Falso",1,Contágios
3100,"Um vídeo viral do portal Tierra Pura com uma entrevista da médica Mariana Colombres Garmendia, quem denuncia o excesso de registro do número de pessoas contagiadas e mortas pela doença Covid-19 na Argentina. A médica também afirma que o governo da província de Buenos Aires paga médicos ou instituições para fazê-lo com o objetivo de estender a quarentena",1,https://chequeado.com/el-explicador/coronavirus-no-hay-pruebas-para-decir-que-se-estan-inflando-los-contagiados-y-muertos-como-dice-este-video-viral/
3101,"Publicações que afirmam que ""a nova vacina contém 'RNA' digitalizável",1,Chequeado
3102,Uma publicação que garante que a Província de Buenos Aires (Argentina) dará um subsídio de $500 a pacientes com coronavírus isolados em centros extra-hospitalares,1,https://chequeado.com/el-explicador/es-verdadero-el-subsidio-de-500-de-la-provincia-a-pacientes-con-coronavirus-aislados-en-centros-extrahospitalarios/
3105,"Um meme alegando que Bill Gates foi ""expulso da Índia por deixar 47.000 crianças com deficiência e permanentemente incapacitadas como resultado direto de sua vacina contra a poliomielite"",""Falso",1,Outros
3106,Um post do Centro de Virologia da Rússia recomendando uma dieta alcalina para combater o coronavírus,1,https://chequeado.com/verificacionfb/es-falso-el-posteo-del-centro-de-virologia-ruso-que-recomienda-una-dieta-alcalina-para-combatir-el-coronavirus/
3107,"Mensagem que garante que o infectologista argentino Pedro Cahn não apresentou ""um trabalho ou foi reconhecido"",""Falso",1,Outros
3108,Um vídeo de uma operação policial na Bolívia com “falsos mortos”,1,https://chequeado.com/el-explicador/no-estas-imagenes-no-son-de-un-operativo-policial-con-un-falso-muerto/
3111,Uma publicação sobre um acidente fatal devido ao uso de máscara por Covid-19,1,https://maldita.es/malditobulo/2020/07/28/accidente-mortal-hipoxia-mascarilla/
3112,"É falso que na maior parte do território espanhol ""a incidência acumulada do vírus"" seja ""inferior à média do Reino Unido",1,28/07/2020
3113,Uma publicação que afirma que vários meios de comunicação europeus inventaram a morte de uma criança por Covid-19,1,https://maldita.es/malditobulo/2020/07/28/nino-muere-tres-veces-coronavirus/
3114,A Guarda Civil Espanhola publicou um cartaz de um suposto imigrante com o Covid-19 fugido em Calpe (Alicante),1,https://maldita.es/malditobulo/2020/07/29/guardia-civil-inmigrante-huido-calpe-alicante-covid-falsa-alarma/
3115,A teoria de que a vacina contra a gripe é uma possível causa da gravidade e virulência da pandemia ou que  o coronavírus foi injetado juntamente com a vacina,1,https://maldita.es/malditaciencia/2020/07/29/no-evidencias-vacuna-gripe-este-relacionada-covid19-riesgo-infeccion-coronavirus/
3116,"Conteúdos que criticam o uso de testes de PCR para a detecção da Covid-19, já que, em teoria, não é específico para SARS-CoV-2, mas é um teste não específico em que material genético de qualquer organismo pode ser detectado e, portanto, de qualquer outro vírus",1,https://maldita.es/malditaciencia/2020/07/29/pruebas-pcr-no-inespecificas-amplifican-material-genetico-sarscov2/
3117,"Um vídeo no qual vários componentes de um grupo de médicos que se autodenominam ""Médicos pela verdade"" defendem e justificam as alegações relacionadas à pandemia e sua gestão política e de saúde",1,https://maldita.es/malditaciencia/2020/07/30/video-asamblea-grupo-medicos-por-la-verdad-afirmaciones-falsas-mascarillas-confinamiento-gripe-tratamiento-covid19/
3119,O governo da Cidade de Buenos Aires (Argentina) está realizando testes em famílias selecionadas.,1,https://chequeado.com/el-explicador/es-verdadero-que-el-gobierno-de-la-ciudad-esta-realizando-testeos-en-viviendas-seleccionadas/
3121,Uma corrente de mensagens garante que o Mentholatum e o eucalipto servem para impedir o desenvolvimento da COVID-19 no corpo humano,1,https://colombiacheck.com/chequeos/no-hay-evidencia-de-que-el-mentholatum-y-el-eucalipto-sirvan-para-impedir-el-desarrollo
3122,Vídeo postado na página do Facebook da Prefeitura de Manizales assegura que nos primeiros 37 dias de funcionamento da Ciclovia “a redução nas emissões de gases do efeito estufa equivalem a 62 toneladas de CO2 no meio ambiente”,1,https://colombiacheck.com/chequeos/falta-incluir-factores-para-estimar-reduccion-de-carbono-en-ciclobanda-de-manizales
3123,"O prefeito de Yopal, Luis Eduardo Castro, e o ex-prefeito da mesma cidade Leonardo Puentes foram ""flagrados"" em um bar gay, violando a quarentena. ",1,https://colombiacheck.com/chequeos/alcalde-de-yopal-no-fue-capturado-en-un-bar-gay-por-violar-la-cuarentena
3124,Uma postagem diz que os médicos podem roubar suas impressões digitais ou informações com o oxímetro de pulso.,1,https://colombiacheck.com/chequeos/no-los-medicos-no-pueden-robar-sus-huellas-digitales-o-datos-con-el-pulsioximetro
3125,"O governador de Córdoba (Colombia), Orlando Benítez Mora, denunciou que as Entidades Promotoras de Saúde (EPS) realizaram testes de COVID-19 em menos de 5% dos habitantes de Córdoba.",1,https://colombiacheck.com/chequeos/las-eps-le-han-hecho-pruebas-de-covid-19-menos-del-5-de-los-habitantes-de-cordoba-como
3126,"Carlos Mario Marín, prefeito de Manizales (Colombia), postou em sua conta no Twitter que “Manizales é uma das nove cidades em que não foram encontrados gastos exagerados nas contratações para o enfrentamento da pandemia"". ",1,https://colombiacheck.com/chequeos/en-manizales-no-se-han-encontrado-sobrecostos-en-contratacion-para-manejo-de-pandemia
3127,"Vídeo garante que o chá de nim é a ""solução"" para a COVID-19",1,https://colombiacheck.com/chequeos/te-de-neem-tampoco-es-la-solucion-para-la-covid-19
3128,Um formulário de solicitação de ajuda ao Governo da Colômbia ,1,https://colombiacheck.com/chequeos/ojo-formulario-de-solicitud-de-ayudas-al-gobierno-nacional-es-falso
3129,O presidente de Gana disse que o coronavírus foi criado em laboratório,1,https://colombiacheck.com/chequeos/es-falso-que-el-presidente-de-ghana-haya-dicho-que-el-coronavirus-fue-creado-en-un
3130,Uma corrente de mensagens disse que se deve despejar cloro ou água sanitária no vaso para conter a expansão do coronavírus.,1,https://colombiacheck.com/chequeos/no-no-se-debe-echar-cloro-lejia-ni-ningun-corrosivo-por-el-inodoro-para-evitar-la
3131,"Claudia López (prefeita de Bógota, Colômbia): “As donas de casa realizam a atividade que, neste momento, registra o maior nível de contágio"". ",1,https://colombiacheck.com/chequeos/amas-de-casa-si-son-la-ocupacion-que-registra-mayor-contagio-en-bogota
3132,Uma corrente de mensagens oferece testes gratuitos para detectar a COVID-19,1,https://colombiacheck.com/chequeos/cuidado-cadena-que-ofrece-pruebas-covid-gratis-es-una-desinformacion
3133,"A sensação de sufocamento que, às vezes, podem provocar as máscaras indica que elas podem causar hipoxia.",1,https://colombiacheck.com/chequeos/la-sensacion-de-agobio-que-veces-pueden-provocar-los-tapabocas-no-significa-que-causen
3134,Imagem de Bolsonaro hospitalizado,1,https://lasillavacia.com/detector-otra-vez-esta-foto-bolsonaro-hospitalizado-no-reciente-77680
3135,Imagem de uma receita médica para tratar o novo coronavírus. ,1,https://lasillavacia.com/detector-esta-prescripcion-medica-enganosa-no-existe-tratamiento-general-covid-77687
3136,Imagem mostra alguns medicamentos com os quais supostamente se previne o novo coronavírus. ,1,https://lasillavacia.com/detector-no-estos-medicamentos-no-previenen-covid-77708
3137,O presidente de Gana disse que a COVID-19 foi criada em laboratório.,1,https://lasillavacia.com/detector-presidente-ghana-no-dijo-covid-se-creo-laboratorio-77712
3138,Uma imagem no Facebook mostra alguns produtos naturais com os quais se pode eliminar o novo coronavírus. ,1,https://lasillavacia.com/detector-otra-vez-mezcla-ingredientes-naturales-no-cura-covid-77726
3139,"Uma imagem que circula, principalmente no WhatsApp, mostra coquetéis de medicamentos para combater a COVID-19",1,https://www.nacion.com/no-coma-cuento/nocomacuento-combos-de-medicamentos/RGDBCAGT2ZBMHOOIF733S2IJYE/story/
3140,"Imagem de um suposto ""nicaraguense sem documentos"" que testou positivo para COVID-19 e que, segundo o gráfico, estaria cuspindo em portas e maçanetas. ",1,https://www.nacion.com/no-coma-cuento/nocomacuento-mensaje-utiliza-foto-de-youtuber/MVULZ2YUBFC3HA7MZN5JRZAEWQ/story/
3141,"Imagem diz que o teste com o qual se detecta a COVID-19 pode causar infecções, inflamação e até mesmo a morte de pacientes.",1,https://www.nacion.com/no-coma-cuento/nocomacuento-es-falso-que-la-prueba-de-covid-1/URXOPGK7KBEHXI6EN66MGUJLGQ/story/
3142,Uma imagem da apresentação de Futurama na qual está proibido viajar no tempo a 2020,1,https://maldita.es/malditobulo/2020/08/03/no-esta-imagen-de-la-intro-de-futurama-en-la-que-prohibe-viajar-en-el-tiempo-a-2020-no-es-real-es-un-montaje/
3143,"Pedro Sánchez, presidente do governo da Espanha, recomenda investir em Bitcoin durante a pandemia.",1,https://maldita.es/malditobulo/2020/08/03/pedro-sanchez-invertir-en-bitcoin-era-ingresos-coronavirus/
3144,"Uma publicação assegura que Pedro Sánchez, presidente do governo da Espanha, falou sobre um Comitê Científico e agora o governo reconhece que esse comitê jamais existiu. ",1,https://maldita.es/malditobulo/2020/08/03/comite-cientifico-no-tecnico-para-desescalada-decide-cambio-fases-sanidad-niega-existencia-covid19/
3145,Uma imagem sobre o uso cotonetes em testes de COVID-19,1,https://lasillavacia.com/detector-imagen-enganosa-sobre-uso-hisopos-pruebas-covid-77735
3146,A aspirina cura a Covid-19,1,https://lasillavacia.com/detector-aspirina-no-cura-covid-19-77739
3147,O médico Raul Salazar indica medicamentos que curam a COVID-19,1,https://lasillavacia.com/detector-otra-vez-medico-raul-salazar-aconseja-medicamentos-no-curan-covid-77746
3148,Um vídeo divulgado como se um manequim fosse apresentado como um paciente com coronavírus. ,1,https://maldita.es/malditobulo/2020/08/03/cuidado-con-este-video-difundido-como-si-nos-estuvieran-enganando-haciendo-pasar-un-maniqui-por-un-paciente-con-coronavirus-es-una-simulacion-realizada-en-un-tren-medicalizado/
3149,Imagens das manifestações em Berlim contra as medidas da Alemanha para enfrentar o coronavírus. ,1,https://maldita.es/malditobulo/2020/08/03/foto-manifestaciones-berlin-anti-mascarillas-coronavirus-puente/
3150,As afirmações deste vídeo de Natalia Prego sobre o coronavírus e o uso de máscaras. ,1,https://maldita.es/malditaciencia/2020/08/03/afirmaciones-falsas-video-natalia-prego-coronavirus-uso-mascarillas/
3151,Uma postagem garante que a fumaça do cigarro transmite o coronavírus. ,1,https://chequeado.com/verificacionfb/es-enganoso-el-posteo-que-asegura-que-el-humo-del-cigarrillo-transmite-el-coronavirus/
3152,"Uma publicação garante que o governo argentino ""quer usar"" militares para testar a vacina contra o coronavírus. ",1,https://chequeado.com/wp-content/uploads/2020/07/Plantilla-desinformacion-13-1-1280x549.png
3153,"Tasuku Honjo, Prêmio Nobel de Medicina, disse que o coronavírus ""não é natural"". ",1,https://chequeado.com/verificacionfb/no-tasuku-honjo-premio-nobel-de-medicina-no-dijo-que-el-coronavirus-no-es-natural/
3154,Uma postagem assegura que um médico do hospital Muñiz chamado “Marcos Vargas” morreu por atender pacientes com coronavírus. ,1,https://chequeado.com/verificacionfb/es-falso-que-un-medico-del-hospital-muniz-llamado-marcos-vargas-fallecio-por-atender-pacientes-con-coronavirus/
3155,A vacina contra o novo coronavírus existe desde 2001,1,https://chequeado.com/verificacionfb/no-la-vacuna-contra-el-nuevo-coronavirus-no-existe-desde-2001/
3156,63 leitos de terapia intensiva foram ocupados por manifestantes contaminados.,1,https://chequeado.com/verificacionfb/es-insostenible-que-63-camas-de-terapia-intensiva-fueron-ocupadas-por-manifestantes-contagiados/
3157,"Axel Kicillof (governador da Província de Buenos Aires, Argentina): “A economia norte-americana sofreu uma queda de 33% de seu PIB. É a maior queda dos últimos 70 anos"". ",1,https://chequeado.com/ultimas-noticias/kicillof-la-economia-norteamericana-sufrio-una-caida-en-su-producto-bruto-interno-del-33-es-la-caida-mas-grande-en-los-ultimos-70-anos/
3158,Uma imagem publicada pela jornalista argentina Viviana Canosa de duas pessoas sem respeitar o distanciamento social na Casa Rosada ,1,https://chequeado.com/el-explicador/no-la-foto-que-publico-viviana-canosa-de-la-casa-rosada-no-es-actual/
3159,"Foto de protesto contra isolamento social em Berlim, Alemanha",1,https://piaui.folha.uol.com.br/lupa/2020/08/03/verificamos-foto-protesto-alemanha/
3160,"Vídeo mostra pátio com ambulâncias parada, na Bahia. Narrador diz que as ambulâncias foram doadas por Jair Bolsonaro e abandonadas deliberadamente, por razões políticas, pelo governador Rui Costa",1,https://piaui.folha.uol.com.br/lupa/2020/08/03/verificamos-bolsonaro-ambulancias-bahia/
3161,Vacinas chinesas contra Covid-19 contém um microchip que usa 5G para controle remoto,1,https://piaui.folha.uol.com.br/lupa/2020/08/04/verificamos-vacina-5g-microchip/
3162,"Compra de produtos chineses caiu 30% em Santa Catarina, graças a boicote motivado pela pandemia",1,https://piaui.folha.uol.com.br/lupa/2020/08/04/verificamos-queda-produtos-chineses/
3163,Países africanos mantém a pandemia sob controle distribuindo milhares de doses de ivermectina para a população,1,https://piaui.folha.uol.com.br/lupa/2020/08/06/verificamos-ivermectina-africa-covid/
3164,"Compra de produtos chineses caiu 78% no Brasil, segundo dados da INCINT",1,https://piaui.folha.uol.com.br/lupa/2020/08/06/verificamos-vendas-produtos-chineses/
3165,"Alexandre Kalil, prefeito de Belo Horizonte, foi almoçar em Nova Lima porque os restaurantes da cidade estão fechados. Lá, foi abordado por eleitores",1,https://piaui.folha.uol.com.br/lupa/2020/08/07/verificamos-video-prefeito-bh-criticado/
3166,Nenhum morador de São Paulo morreu de COVID-19 nos dias 4 e 5 de agosto,1,https://piaui.folha.uol.com.br/lupa/2020/08/07/verificamos-paulistano-morreu-covid-19/
3167,"Deputado brasileiro afirma que pandemia começa a diminuir em seu estado, o Rio Grande do Sul.",1,https://politica.estadao.com.br/blogs/estadao-verifica/osmar-terra-usa-dados-de-um-unico-hospital-para-dizer-que-covid-19-esta-reduzindo-no-rs/
3168,Foto mostra hidroxicloroquina sendo vendida em trens públicos do Rio de Janeiro.,1,https://politica.estadao.com.br/blogs/estadao-verifica/imagem-que-circula-nas-redes-sociais-nao-comprova-venda-de-cloroquina-em-trem-no-rio-de-janeiro/
3173,Uma corrente que lista as recomendações sobre o coronavírus do médico Faheem Younus,1,https://chequeado.com/verificacionfb/es-verdadera-la-cadena-que-enumera-las-recomendaciones-sobre-el-coronavirus-del-medico-faheem-younus/
3174,"A nova vacina contém um replicador digitalizável ""RNA"" que é ativado com 5G, para que o vírus possa ser reativado após a recuperação do paciente",1,https://animal.mx/2020/07/vacuna-covid-arn-digitalizable-red-5g-covid-19/
3175,Uma lista de recomendações que inclui a automedicação com 8 medicamentos diferentes e uma dieta à base de gemada e refrigerante.,1,https://www.animalpolitico.com/elsabueso/comer-ponche-hidratarte-pepsi-no-recomendaciones-pacientes-covid-19/
3176,"As imagens de um homem com uma máscara de ouro são de um líder religioso que ""pediu à sua congregação uma máscara de ouro porque Deus assim revelou para ele em um sonho"". ",1,https://www.animalpolitico.com/elsabueso/falso-pastor-pide-cubrebocas-de-oro-congregacion/
3177,"Um vídeo, compartilhado por Madonna, de um médico em uma entrevista coletiva que disse que a hidroxicloroquina é uma cura para a Covid-19 e que as máscaras não são necessárias",1,https://animal.mx/2020/07/falso-video-madonna-hidroxicloroquina-covid/
3178,"Em 2011, o filme Capitão América mostra a imagem do coronavírus causador da Covid-19",1,https://animal.mx/2020/07/falso-times-square-capitan-america-coronavirus/
3179,O uso de máscaras está causando pneumonia,1,https://maldita.es/malditaciencia/2020/08/04/no-hay-ninguna-evidencia-de-que-el-uso-de-las-mascarillas-este-causando-neumonias/
3180,Uma imagem de 500 embarcações na Argélia prestes a zarparem para a Espanha com pessoas infectadas com Covid-19,1,https://maldita.es/malditobulo/2020/08/04/foto-500-pateras-argelia-espana-contagiadas-es-mauritania-en-2019-y-son-barcos-de-pesca/
3181,Uma imagem da manifestação em Berlim contra as medidas da Alemanha para conter o coronavírus,1,https://maldita.es/malditobulo/2020/08/04/foto-manifestacion-berlin-antimascarillas-alemania-coronavirus-loveparade/
3182,"Um vídeo que diz que a tenda do Hospital Arnau de Vilanova de Lleida (Espanha) é uma ""mentira"",""Boato",1,Outros
3183,"A Organização Mundial da Sáude (OMS) disse que não há ""solução e talvez nunca haja"" para o coronavírus",1,https://chequeado.com/el-explicador/es-enganoso-que-la-oms-dijo-que-no-hay-solucion-y-quizas-nunca-la-haya-para-el-coronavirus/
3186,Imagens da manifestação de 1º de agosto em Berlim contra as medidas da Alemanha para conter o coronavírus,1,https://maldita.es/malditobulo/2020/08/05/fotos-manifestacion-1-agosto-berlin-alemania-coronavirus/
3187,Um vídeo mostra um suposto falecido por Covid-19 levantando o braço na Bolívia,1,https://maldita.es/malditobulo/2020/08/05/video-fallecido-covid-19-levantando-brazo-bolivia/
3188,"Postagem que indica que um trabalhador do Hospital Muñiz (Buenos Aires, Argentina) morreu por tratar pacientes com Covid-19",1,https://chequeado.com/verificacionfb/es-falso-el-posteo-que-indica-que-murio-un-trabajador-del-hospital-muniz-por-atender-pacientes-con-covid-19/
3196,"Escritório das Nações Unidas para a Coordenação de Assuntos Humanitários (OCHA, por sua sigla em português): ""67% dos casos COVID-19 na Venezuela são de transmissão comunitária"",""Verdadeiro",1,Contágios
3198,O dióxido de cloro remove o coronavírus do corpo em 48 horas,1,https://colombiacheck.com/chequeos/no-el-dioxido-de-cloro-no-elimina-el-coronavirus-del-cuerpo-en-48-horas-como-dice-supuesto
3199,"Nenhuma cura foi encontrada para a Covid-19, como diz o vídeo viral da doutora Stella Immanuel",1,https://colombiacheck.com/chequeos/no-se-ha-encontrado-cura-para-covid-19-como-dice-video-viral-con-la-doctora-stella
3200,Cientista Boyaca (Departamento colombiano) que afirma curar pacientes com Covid-19 por meio da biologia molecular,1,24/07/2020
3201,"""A nova vacina"" contra o coronavírus possui ""RNA digitalizável"" que é ""ativado por 5G"" e pode reativar o vírus",1,https://colombiacheck.com/chequeos/es-falso-que-la-nueva-vacuna-contra-el-coronavirus-tiene-arn-digitalizable-que-se-activa
3202,A marca Adidas está dando máscaras,1,https://colombiacheck.com/chequeos/no-adidas-no-esta-regalando-tapabocas
3203,"O prefeito de Ibagué (Tolima, na Colômbia), Andrés Fabián Hurtado, publicou no dia 19 de julho um vídeo em sua conta no Facebook em que afirma que “mais de 4 milhões de empregos foram perdidos na cidade de Ibagué” no primeiro semestre de 2020",1,https://colombiacheck.com/chequeos/alcalde-de-ibague-exagero-el-numero-de-empleos-perdidos-en-la-ciudad
