,noticia,verdadeira,url
1085,"Vídeo mostra confronto entre usuários de drogas na Cracolância, Centro de São Paul, e Guarda Municipal. Na legenda, afirma-se que é isso que está acontecendo enquanto a cidade está em isolamento.",1,https://piaui.folha.uol.com.br/lupa/2020/04/03/verificamos-video-confronto-cracolandia-pandemia-covid-19/
1086,"Deputado Federal Osmar Terra afirma que, na Itália, as políticas de isolamento social fizeram com que os casos da COVID-19 disparassem.",1,https://piaui.folha.uol.com.br/lupa/2020/04/04/osmar-terra-quarentena-italia-coronavirus/
1087,Pesquisador americano Charles Lieber foi preso por vender o novo coronavírus aos chineses.,1,https://piaui.folha.uol.com.br/lupa/2020/04/06/verificamos-e-falso-pesquisador-preso-por-fabricar-coronavirus/
1088,"Salim Mattar, proprietário da Localiza (empresa brasileira de aluguel de carros) critica as medidas de isolamento relacionadas à COVID-19.",1,https://piaui.folha.uol.com.br/lupa/2020/04/06/verificamos-localiza-coronavirus/
1089,"Rodrigo Maia, presidente da Câmara dos Deputados, disse no Twitter que prefere ver algumas pessoas morrerem de COVID-19 antes de usar o dinheiro dos fundos públicos eleitorais para pagar pelo tratamento.",1,https://piaui.folha.uol.com.br/lupa/2020/04/06/verificamos-maia-fundo-eleitoral-coronavirus/
1090,Brasil foi classificado pelo Banco Mundial como o país com melhores políticas de combate à COVID-19.,1,https://piaui.folha.uol.com.br/lupa/2020/04/07/verificamos-banco-mundial-coronavirus/
1091,Vídeo mostra um suposto dono de hotel em Nova York que pulou de uma janela depois de demitir todos os seus funcionários. O hotel faliu devido às políticas de isolamento social.,1,https://piaui.folha.uol.com.br/lupa/2020/04/07/verificamos-empresario-suicidio-nova-york/
1092,"Fábio de Melo, famoso padre brasileiro, publicou texto criticando o isolamento social e pedindo empatia por quem precisa trabalhar.",1,https://piaui.folha.uol.com.br/lupa/2020/04/07/verificamos-padre-fabio-melo-coronavirus/
1093,"O Hospital Leonardo Da Vinci, referência para tratamento da COVID-19 em Fortaleza (CE), Brasil, está vazio. Um vídeo ""prova"" que não havia ninguém nas áreas abertas ao público.",1,https://piaui.folha.uol.com.br/lupa/2020/04/08/verificamos-hospital-fortaleza-vazio/
1094,"Roberto Gazolla, hospital de referência para tratamento da COVID-19 no Rio de Janeiro, Brasil, está vazio. As fotos ""provam"" que não havia ninguém nas áreas abertas ao público, como o hall de entrada.",1,https://piaui.folha.uol.com.br/lupa/2020/04/08/verificamos-hospital-rio-coronavirus/
1095,"Programa da RAI TV, emissora italiana, de 2015 alertou sobre a pesquisa chinesa para criar um novo coronavírus a partir de outras partes do vírus. Tudo aconteceu em Wuhan.",1,https://piaui.folha.uol.com.br/lupa/2020/04/08/verificamos-reportagem-italiana-pesquisa-coronavirus-covid-19/
1096,"Foto mostra aglomeração de pessoas na Cracolândia, Centro de São Paulo, supostamente durante a pandemia de coronavírus.",1,https://piaui.folha.uol.com.br/lupa/2020/04/09/verificamos-foto-aglomeracao-cracolandia-covid-19/
1097,"Vídeo mostra homem em frente ao Estádio do Pacaembu, em São Paulo, onde foi construído um hospital de campanha para pacientes com COVID-19. Ele afirma que, como não há movimento na entrada, ninguém esperando para entrar, também não há ninguém lá dentro.",1,https://piaui.folha.uol.com.br/lupa/2020/04/09/verificamos-hospital-pacaembu-pacientes/
1098,Número de mortes por COVID-19 em São Paulo (Brasil) foi revisada: de 201 casos confirmados para apenas 26.,1,https://piaui.folha.uol.com.br/lupa/2020/04/09/verificamos-numero-casos-revisado-coronavirus/
1099,"Um homem chamado Antonio Carlos, 67 anos, acaba de ser curado da COVID-19 usando cloroquina. Ele foi liberado do Hospital Unimed, no Rio de Janeiro (Brasil).",1,https://piaui.folha.uol.com.br/lupa/2020/04/09/verificamos-tuite-cura-primo-antonio-carlos-cloroquina-hospital-rio/
1100,Rede de supermercados Lidl está oferecendo 250 euros em alimentos devido à nova pandemia de coronavírus.,1,https://poligrafo.sapo.pt/fact-check/coronavirus-os-supermercados-lidl-estao-a-oferecer-alimentos-no-valor-de-250-euros
1101,Autoridades portuguesas decidiram que cada cidadão que for trabalhar deve ter uma autorização oficial para sair de casa.,1,https://poligrafo.sapo.pt/fact-check/e-obrigatorio-ter-uma-declaracao-que-ateste-estar-a-trabalhar-para-poder-sair-a-rua
1102,"Em e-mail enviado às principais redações de jornais, o governo português anuncia o cancelamento de projetos nos aeroportos devido às restrições financeiras causadas pelo impacto do coronavírus.",1,https://poligrafo.sapo.pt/fact-check/governo-anuncia-cancelamento-dos-projetos-dos-aeroportos-do-montijo-e-da-portela
1103,Governo português gastou muito mais do que o preço aceitável para ventiladores.,1,https://poligrafo.sapo.pt/fact-check/governo-comprou-ventiladores-a-china-por-20-mil-euros-cada-mas-em-portugal-custam-apenas-3-500-euros
1104,Jogador de futebol português Cristiano Ronaldo decidiu transformar seus hotéis em hospitais gratuitos,1,https://poligrafo.sapo.pt/fact-check/hoteis-de-ronaldo-vao-ser-transformados-em-hospitais-para-receber-doentes-com-coronavirus
1105,Aplicativo Houseparty foi hackeado.,1,https://poligrafo.sapo.pt/fact-check/houseparty-a-aplicacao-que-explodiu-durante-o-surto-do-novo-coronavirus-foi-alvo-de-pirataria
1106,Uma publicação no Facebook sugere que a China criou o novo coronavírus para matar 1% da sua população.,1,https://poligrafo.sapo.pt/fact-check/o-novo-coronavirus-foi-criado-pela-china-em-laboratorio-para-matar-1-da-sua-populacao
1107,"Mensagem enviada por e-mail afirma que o Ministério da Defesa da China anunciou que ""com sucesso"" desenvolveu uma vacina contra o novo coronavírus, que causa a doença de COVID-19. Portugal receberia as primeiras doses em poucos dias. ",1,https://poligrafo.sapo.pt/fact-check/sns-enviou-e-mail-a-anunciar-que-vacina-para-o-coronavirus-chega-a-portugal-nos-proximos-dias
1108,Vídeo postado no Twitter mostra um grupo de chineses se convertendo ao Islã sob o argumento de que os muçulmanos são imunes à COVID-19.,1,https://poligrafo.sapo.pt/sociedade/artigos/coronavirus-video-viral-garante-que-islamicos-sao-imunes-e-falso
1109,Beber água a cada 15 minutos evita o coronavírus.,1,https://politica.estadao.com.br/blogs/estadao-verifica/administradora-de-125-condominios-divulga-informacao-errada-de-protecao-contra-coronavirus/
1110,A auto-hemoterapia cura o COVID-19.,1,https://politica.estadao.com.br/blogs/estadao-verifica/ainda-nao-existe-cura-para-coronavirus-auto-hemoterapia-nao-tem-comprovacao-e-pode-ser-perigosa/
1111,"Um médico do Rio de Janeiro, Brasil, divulgou áudio dizendo que o isolamento deve terminar porque há poucos pacientes com COVID-19 na cidade.",1,https://politica.estadao.com.br/blogs/estadao-verifica/audio-no-qual-um-suposto-medico-de-hospital-do-rio-de-janeiro-defende-o-fim-da-quarentena-tem-informacoes-falsas/
1112,Suposto assessor político teria pedido a meios de comunicação para difamar o presidente brasileiro Jair Bolsonaro.,1,https://politica.estadao.com.br/blogs/estadao-verifica/audio-vazado-de-suposto-assessor-do-governador-do-ceara-e-falso/
1113,A empresa Ambev distribuirá desinfetante para as mãos da população.,1,https://politica.estadao.com.br/blogs/estadao-verifica/boato-adultera-noticia-de-doacao-de-alcool-em-gel-pela-ambev/
1114,Comida foi descartada após decreto do governador de São Paulo,1,https://politica.estadao.com.br/blogs/estadao-verifica/boato-falso-associa-quarentena-com-video-antigo-de-descarte-de-alimentos/
1115,Teste para o coronavírus custa US $ 3.000 nos Estados Unidos.,1,https://politica.estadao.com.br/blogs/estadao-verifica/boato-falso-diz-que-teste-para-coronavirus-nos-eua-custa-mais-de-us-3-mil/
1116,China planejou o coronavírus.,1,https://politica.estadao.com.br/blogs/estadao-verifica/boato-no-facebook-inventa-que-novo-coronavirus-foi-planejado-pela-china/
1117,Foi retirado dinheiro de hospitais para financiar projetos culturais no Brasil.,1,https://politica.estadao.com.br/blogs/estadao-verifica/boato-usa-lista-desatualizada-de-projetos-da-lei-rouanet-para-inventar-desvio-de-dinheiro-da-saude/
1118,Decreto do governador de São Paulo aumenta artificialmente o número de mortes por COVID-19.,1,https://politica.estadao.com.br/blogs/estadao-verifica/bolsonaristas-distorcem-teor-de-decreto-de-doria-para-espalhar-desinformacao-sobre-contagem-de-casos-de-covid-19/
1119,A empresa brasileira de bebidas Ambev interrompe a produção de cerveja.,1,https://politica.estadao.com.br/blogs/estadao-verifica/coronavirus-ambev-desmente-suspensao-de-producao-de-cerveja-por-pandemia/
1120,"Suposto áudio do CEO de um grande hospital de São Paulo, Brasil, afirma que número de mortes por coronavírus é maior do que o anunciado oficialmente.",1,https://politica.estadao.com.br/blogs/estadao-verifica/coronavirus-audio-exagera-numero-de-casos-na-prevent-senior/
1121,"O diretor de um grande hospital de São Paulo, Brasil, recomendou beber chá de erva-doce e comer fígado de boi como forma de prevenção à COVID-19.",1,https://politica.estadao.com.br/blogs/estadao-verifica/coronavirus-corrente-de-whatsapp-dissemina-informacoes-falsas-sobre-prevencao/
1122,Presidente Jair Bolsonaro declarou feriado nacional devido ao coronavírus.,1,https://politica.estadao.com.br/blogs/estadao-verifica/coronavirus-decreto-de-feriado-nacional-de-sete-dias-e-pegadinha/
1123,Aposentadoria de idosos que saem às ruas em quarentena será cortada.,1,https://politica.estadao.com.br/blogs/estadao-verifica/coronavirus-e-falso-alerta-sobre-perda-de-aposentadoria-para-idosos-que-sairem-as-ruas-durante-quarentena/
1124,"Estudo comprova que teorias da conspiração, como criação do coronavírus pela China para fins econômicos, estão erradas.",1,https://politica.estadao.com.br/blogs/estadao-verifica/coronavirus-estudo-desmente-teoria-conspiratoria-sobre-criacao-em-laboratorio-da-china/
1125,"Fiocruz compartilha alerta em que afirma que coronavírus é maior que outros vírus e que morre em temperaturas como 26ºC ou 27ºC, entre outros ",1,https://politica.estadao.com.br/blogs/estadao-verifica/coronavirus-fiocruz-alerta-para-mensagem-falsa-que-circula-no-whatsapp/
1126,"Vídeo mostra animais mortos, como cães, ratos, morcegos e cobras, sendo vendidos em um mercado em Wuhan.",1,https://politica.estadao.com.br/blogs/estadao-verifica/coronavirus-imagens-de-mercado-de-animais-sao-da-indonesia-e-nao-da-china/
1127,Papa Francisco foi diagnosticado com coronavírus.,1,https://politica.estadao.com.br/blogs/estadao-verifica/coronavirus-ja-esta-ate-no-vaticano-mas-papa-francisco-nao-foi-infectado/
1128,Governo brasileiro libera R$ 470 para pessoas do Bolsa Família (programa de combate à pobreza) para comprar máscaras e produtos de higiene.,1,https://politica.estadao.com.br/blogs/estadao-verifica/coronavirus-mensagem-sobre-saque-de-r-470-do-bolsa-familia-e-falsa/
1129,Nostradamus previu a pandemia de coronavírus.,1,https://politica.estadao.com.br/blogs/estadao-verifica/coronavirus-postagens-inventam-profecia-de-nostradamus-sobre-pandemia/
1130,Analista israelense sugere que o coronavírus pode ser uma arma biológica criada em laboratório.,1,https://politica.estadao.com.br/blogs/estadao-verifica/coronavirus-site-distorce-entrevista-para-sugerir-possibilidade-de-criacao-de-arma-biologica/
1131,Beber chá e água quente mata o coronavírus. Fatias de limão em água morna podem salvar sua vida. É recomendável guardar dinheiro em um saco plástico selado. Teoria da conspiração sugere que a China está se beneficiando da pandemia. Vinagre é bom para limpar as mãos.,1,https://politica.estadao.com.br/blogs/estadao-verifica/coronavirus-veja-correntes-com-informacoes-falsas-que-circulam-no-whatsapp/
1132,Médico diz que o coronavírus não mata nem causa o resfriado comum.,1,https://politica.estadao.com.br/blogs/estadao-verifica/desinformacao-sobre-coronavirus-pode-vir-ate-de-medicos-veja-o-que-dizem-os-orgaos-oficiais/
1133,Xangai e Pequim não tiveram casos de coronavírus.,1,https://politica.estadao.com.br/blogs/estadao-verifica/e-falsa-a-corrente-que-diz-que-xangai-e-pequim-nao-tiveram-casos-de-coronavirus/
1134,"Mensagem alega que a COVID-19 teria um prazo de ""infecção máxima"" até 3 de abril no Brasil.",1,https://politica.estadao.com.br/blogs/estadao-verifica/e-falsa-a-corrente-que-fala-em-etapa-maxima-de-infeccao-pelo-novo-coronavirus-ate-3-de-abril/
1135,Publicação no Facebook diz que os congressistas brasileiros se negaram a devolver seus pagamentos para combater a COVID-19.,1,https://politica.estadao.com.br/blogs/estadao-verifica/e-falsa-postagem-sobre-votacao-de-deputados-para-nao-abrir-mao-dos-salarios/
1136,Israel tem a melhor situação do mundo diante da pandemia de coronavírus sem medidas de isolamento.,1,https://politica.estadao.com.br/blogs/estadao-verifica/e-falso-que-israel-controle-o-coronavirus-sem-distanciamento-social/
1137,232 crianças morreram do COVID-19 na Itália em apenas um dia.,1,https://politica.estadao.com.br/blogs/estadao-verifica/e-falso-que-italia-tenha-registrado-232-mortes-de-criancas-pela-covid-19/
1138,"Um estudo do Dr. Vladimir Zelenko teve 100% de sucesso no uso de hidroxicloroquina, zinco e azitromicina para curar o coronavírus.",1,https://politica.estadao.com.br/blogs/estadao-verifica/estudo-do-medico-vladimir-zelenko-com-hidroxicloroquina-nao-tem-comprovacao-cientifica/
1139,Cloroquina cura o COVID-19.,1,https://politica.estadao.com.br/blogs/estadao-verifica/estudos-com-hidroxicloroquina-sao-preliminares-nao-compartilhe-promessas-de-curas-milagrosas-do-coronavirus/
1140,Formulário em português compartilhado via WhatsApp pede que as pessoas forneçam dados pessoais para receber ajuda econômica do governo.,1,https://politica.estadao.com.br/blogs/estadao-verifica/formulario-que-pede-dados-para-receber-beneficio-emergencial-e-falso/
1141,A ajuda liberada pelo governo brasileiro fez uma multidão se reunir em uma agência bancária.,1,https://politica.estadao.com.br/blogs/estadao-verifica/foto-antiga-de-aglomeracao-em-agencia-da-caixa-e-usada-em-boato-sobre-auxilio-de-r-600/
1142,Paciente infectado com coronavírus foi morto por traficantes.,1,https://politica.estadao.com.br/blogs/estadao-verifica/gerador-de-falsas-manchetes-impulsiona-boataria-sobre-coronavirus-e-trafico/
1143,Edifício de uma federação da indústria exibia a bandeira da China na frente.,1,https://politica.estadao.com.br/blogs/estadao-verifica/imagem-de-predio-da-fiesp-com-bandeira-da-china-e-usada-fora-de-contexto/
1144,"Imagem do repórter de TV em traje de proteção é a prova de que a mídia está ""fabricando"" o pânico.",1,https://politica.estadao.com.br/blogs/estadao-verifica/imagem-de-reporter-com-traje-de-protecao-contra-o-coronavirus-e-tirada-de-contexto-para-atacar-a-midia/
1145,Limão e bicarbonato curam COVID-19.,1,https://politica.estadao.com.br/blogs/estadao-verifica/limao-com-bicarbonato-nao-cura-covid-19-e-pode-fazer-mal-a-saude/
1146,A Netflix oferece acesso gratuito a quem está em quarentena.,1,https://politica.estadao.com.br/blogs/estadao-verifica/mensagem-que-promete-netflix-gratis-durante-isolamento-por-coronavirus-e-golpe/
1147,Exército brasileiro construiu 2.000 leitos hospitalares em 48 horas.,1,https://politica.estadao.com.br/blogs/estadao-verifica/ministerio-da-defesa-desmente-boato-de-que-exercito-tenha-construido-2-mil-leitos-em-48-horas/
1148,Pessoa infectada com coronavírus mordeu a jugular de um médico.,1,https://politica.estadao.com.br/blogs/estadao-verifica/paciente-com-coronavirus-nao-morde-cuidado-com-os-boatos/
1149,Usar uma mão não dominante para abrir portas é uma maneira de impedir o coronavírus.,1,https://politica.estadao.com.br/blogs/estadao-verifica/para-evitar-covid-19-lave-as-maos-usar-mao-nao-dominante-nao-garante-prevencao/
1150,Um bordel na Espanha está em quarentena.,1,https://politica.estadao.com.br/blogs/estadao-verifica/piada-sobre-coronavirus-em-prostibulo-se-espalha-e-engana-desavisados/
1151,O prefeito de Curitiba no Brasil não decretou o fechamento de lojas e a cidade não registrou nenhuma morte pelo COVID-19.,1,https://politica.estadao.com.br/blogs/estadao-verifica/post-no-facebook-distorce-fatos-sobre-combate-a-coronavirus-em-curitiba/
1152,Prefeitura de São Paulo agenda testes de coronavírus por telefone.,1,https://politica.estadao.com.br/blogs/estadao-verifica/prefeitura-de-sp-esclarece-que-numero-156-nao-agenda-teste-de-coronavirus-em-casa/
1153,Receitas caseiras para gel de álcool.,1,https://politica.estadao.com.br/blogs/estadao-verifica/receitas-de-alcool-gel-caseiro-nao-sao-eficazes-contra-coronavirus-e-podem-ser-perigosas/
1154,Uma notícia da TV italiana RAI prova que o coronavírus foi criado em laboratório pelo governo chinês.,1,https://politica.estadao.com.br/blogs/estadao-verifica/reportagem-de-tv-italiana-sobre-virus-criado-em-laboratorio-chines-nao-tem-relacao-com-a-covid-19/
1155,"Médico Drauzio Varella diz em vídeo para as pessoas ""não entrarem em pânico"" sobre a COVID-19.",1,https://politica.estadao.com.br/blogs/estadao-verifica/ricardo-salles-publica-video-antigo-de-drauzio-varella-sobre-coronavirus/
1156,Cuba desenvolveu uma vacina contra o coronavírus.,1,https://politica.estadao.com.br/blogs/estadao-verifica/vacina-cubana-contra-coronavirus-e-ficcao/
1157,As vacinas da COVID-19 virão com um microchip para controlar a população.,1,https://politica.estadao.com.br/blogs/estadao-verifica/vacina-do-coronavirus-nao-tera-microchip-para-rastrear-a-populacao/
1158,"Tedros Adhanom Ghebreyesus, diretor-geral da OMS, é contra o distanciamento social.",1,https://politica.estadao.com.br/blogs/estadao-verifica/video-do-diretor-da-oms-foi-tirado-de-contexto-para-validar-discurso-de-bolsonaro/
1159,"Famoso médico brasileiro defende a abordagem do ""distanciamento social vertical"".",1,https://politica.estadao.com.br/blogs/estadao-verifica/videos-de-osmar-terra-sao-compartilhados-como-se-fossem-do-ex-ministro-adib-jatene/
1160,"Se a população russa não obedecer ao isolamento obrigatório, as pessoas poderão ser presas por cinco anos.",1,https://poligrafo.sapo.pt/fact-check/se-os-russos-nao-acatarem-isolamento-obrigatorio-tem-de-cumprir-cinco-anos-de-prisao
1161,Postagem afirma que a OMS alertou contra o sexo desprotegido com animais para evitar uma infecção por coronavírus.,1,https://observador.pt/factchecks/fact-check-oms-desaconselha-sexo-desprotegido-com-animais-para-prevenir-coronavirus/
1162,Conteúdos em redes sociais afirmam que as mortes por coronavírus estão ligadas à tecnologia 5G.,1,https://observador.pt/factchecks/fact-check-e-a-cobertura-5g-que-esta-a-provocar-as-mortes-associadas-ao-coronavirus/
1163,O novo coronavírus pode ser curado com água e alho.,1,https://observador.pt/factchecks/fact-check-coronavirus-pode-ser-curado-com-uma-tigela-de-agua-de-alho/
1164,O uso de cocaína mata o coronavírus,1,https://observador.pt/factchecks/fact-check-o-consumo-de-cocaina-mata-o-coronavirus/
1165,Pele negra é resistente ao coronavírus.,1,https://observador.pt/factchecks/fact-check-a-pele-negra-e-resistente-ao-coronavirus/
1166,"Publicação afirma que filme previu a pandemia e é chamado de ""Coronavírus"".",1,https://observador.pt/factchecks/fact-check-filme-de-2013-previa-epidemia-e-chamava-se-coronavirus/
1167,Artigo diz que o Vaticano confirmou que o papa e dois assistentes têm coronavírus.,1,https://observador.pt/factchecks/fact-check-vaticano-confirmou-que-papa-e-dois-assistentes-tem-coronavirus/
1168,"Postagem afirma que, se você prender a respiração, poderá dizer se está infectado pela Covid-19 ou não.",1,https://observador.pt/factchecks/suster-a-respiracao-e-um-teste-que-mostra-se-a-pessoa-esta-infetada-com-coronavirus/
1169,"Postagem afirma que os EUA prenderam o homem que ""vendeu"" o novo coronavírus para a China.",1,https://observador.pt/factchecks/fact-check-os-eua-prenderam-homem-que-tera-vendido-o-novo-coronavirus-a-china/
1170,Postagem afirma que Barack Obama alertou os africanos para não aceitarem vacinas europeias ou americanas.,1,https://observador.pt/factchecks/fact-check-barack-obama-avisou-africanos-para-nao-aceitarem-vacinas-europeias-ou-americanas/
1171,"Um ministro holandês disse que ""dar dinheiro aos políticos portugueses é como colocar um gato em uma cesta de sardinha"".",1,https://observador.pt/factchecks/ministro-holandes-disse-que-dar-dinheiro-a-politicos-portugueses-e-como-colocar-um-gato-a-guardar-um-cabaz-de-sardinhas/
1172,Vídeo mostra cartomante prevendo a pandemia de coronavírus em dezembro na TV espanhola.,1,https://observador.pt/factchecks/fact-check-uma-vidente-previu-a-pandemia-da-covid-19-na-televisao-espanhola-em-dezembro/
1173,"Vídeo mostra uma ""caça aos idosos"" na Sérvia durante uma pandemia de Covid-19.",1,https://observador.pt/factchecks/fact-check-video-mostra-uma-caca-aos-velhos-na-servia-durante-pandemia-de-covid-19/
1174,"Governador de São Paulo, João Doria, transferiu um helicóptero usado para o casos de saúde para uso pessoal.",1,https://politica.estadao.com.br/blogs/estadao-verifica/transferencia-de-helicoptero-da-policia-de-sp-e-alvo-de-boato-nas-redes-sociais/
1175,Pesquisadores australianos descobriram a cura para o coronavírus: um medicamento antiparasitário chamado Ivermectina.,1,https://politica.estadao.com.br/blogs/estadao-verifica/estudo-australiano-ainda-nao-provou-eficacia-de-remedio-contra-coronavirus-em-humanos/
1176,Comer alho cru e açafrão todos os dias protege você contra o coronavírus.,1,https://politica.estadao.com.br/blogs/estadao-verifica/ainda-nao-existe-vacina-contra-coronavirus-e-falso-que-alho-e-acafrao-da-terra-previnam-infeccao/
1177,Um corretor brasileiro que trabalha na Nasdaq gravou vídeo em defesa do presidente brasileiro Jair Bolsonaro.,1,https://politica.estadao.com.br/blogs/estadao-verifica/nenhum-dos-homens-que-aparecem-em-videos-criticando-isolamento-e-analista-da-bolsa-nadaq/
1178,Semana Bolsonaro é um movimento para reabrir lojas no Brasil e vender produtos com descontos.,1,https://politica.estadao.com.br/blogs/estadao-verifica/video-de-grupo-bolsonarista-engana-ao-falar-em-mobilizacao-nacional-para-a-reabertura-do-comercio/
1179,"O principal hospital de São Paulo, Brasil não possui pacientes infectados pela Covid-19.",1,https://politica.estadao.com.br/blogs/estadao-verifica/e-falso-que-hospital-das-clinicas-nao-tenha-pacientes-com-covid-19/
1180,"Um homem chamado Antonio Carlos, 67 anos, foi tratado no Hospital Unimed-Rio e curado com tratamento com cloroquina.",1,https://politica.estadao.com.br/blogs/estadao-verifica/hospital-nega-que-tenha-tratado-primo-antonio-carlos-com-cloroquina/
1181,"Vídeo no Hospital das Clínicas, São Paulo, mostra uma sala de espera vazia. A pessoa que filma afirma que o governo está mentindo quando diz que há pacientes com COVID-19 no hospital.",1,https://piaui.folha.uol.com.br/lupa/2020/04/13/verificamos-hospital-das-clinicas-covid-19/
1182,O FDA (Food and Drug Administration) aprovou o uso de cloroquina em todos os pacientes com COVID-19 nos Estados Unidos.,1,https://piaui.folha.uol.com.br/lupa/2020/04/13/verificamos-fda-liberou-hidroxicloroquina-todos-pacientes-covid-19/
1183,A atriz brasileira Fernanda Torres disse que espera que o coronavírus mate muitas pessoas.,1,https://politica.estadao.com.br/blogs/estadao-verifica/posts-distorcem-artigo-de-fernanda-torres-sobre-coronavirus/
1184,OMS declarou que não há possibilidade de o coronavírus ser transmitido por aerossóis.,1,https://politica.estadao.com.br/blogs/estadao-verifica/nao-ha-consenso-sobre-possibilidade-de-coronavirus-ser-transmitido-pelo-ar/
1185,Governo do Pará escalou prisioneiros para monitorar se a população está cumprindo as regras de distância social em pontos de ônibus no Brasil,1,https://aosfatos.org/noticias/presos-nao-vao-monitorar-populacao-em-pontos-de-onibus-no-para/
1186,O FDA (Food and Drug Administration dos EUA) aprovou o uso de hidroxicloroquina em todos os pacientes com Covid-19.,1,https://aosfatos.org/noticias/e-falso-que-fda-aprovou-uso-da-hidroxicloroquina-para-todos-os-pacientes-com-covid-19/
1187,Vídeo mostra policiais brasileiros expulsando pessoas das praias com spray de pimenta e balas de borracha por causa das medidas restritivas da COVID-19.,1,https://aosfatos.org/noticias/video-que-mostra-acao-da-pm-em-praia-e-antigo-e-sem-relacao-com-isolamento-social/
1188,Governador de São Paulo ordenou que polícia espancasse pessoas que saíssem às ruas,1,https://politica.estadao.com.br/blogs/estadao-verifica/video-e-tirado-de-contexto-para-distorcer-acoes-do-governo-doria-no-enfrentamento-a-covid-19/
1189,O número de mortes relacionadas à covid-19 caiu desde que a polícia federal iniciou uma investigação sobre o número de óbitos,1,https://politica.estadao.com.br/blogs/estadao-verifica/pf-nao-tem-inquerito-para-apurar-mortes-pela-covid-19/
1190,Ministro do STF decidiu que estados e cidades não podem criar legislação para evitar que as pessoas saiam do isolamento,1,https://politica.estadao.com.br/blogs/estadao-verifica/dias-toffoli-nao-impediu-estados-e-municipios-de-imporem-restricoes-a-circulacao-de-pessoas/
1191,Desembargador e advogados escreveram petição pedindo a prisão de ministros do STF e governadores no Brasil.,1,https://politica.estadao.com.br/blogs/estadao-verifica/desembargador-e-advogados-nao-acionaram-forcas-armadas-contra-stf-e-governadores/
1192,Colômbia tem a menor taxa  de mortes e contagiados pela Covid-19 no continente americano.,1,https://lasillavacia.com/detector-no-colombia-no-tiene-tasa-mas-baja-america-muertos-y-contagiados-covid-19
