,noticia,verdadeira,url
2051,Vídeo de um suposto doente de COVID-19 que desmaia na Nicarágua ,1,https://www.nacion.com/no-coma-cuento/nocomacuento-video-de-supuesto-enfermo-de-covid/RNYWCWTZD5GFRHOW52TQKH5OMM/story/
2052,COVID-19 causa a síndrome de Kawasaki em bebês,1,https://verificado.com.mx/sindromes-inflamatorios-en-infantes-con-covid-19-estan-bajo-investigacion/
2054,"Uma postagem dizendo que o médico Marcos Vargas, do Hospital Santojanni, morreu por atender pacientes com o coronavírus. ",1,https://chequeado.com/verificacionfb/es-falso-que-el-medico-marcos-vargas-del-hospital-santojanni-fallecio-por-atender-pacientes-con-coronavirus/
2057,Imagem do canal Crónica com declarações do presidente da Suécia sobre o governo argentino,1,https://chequeado.com/verificacionfb/es-falsa-la-placa-de-cronica-con-declaraciones-del-presidente-de-suecia-sobre-el-gobierno-argentino/
2061,Vídeo anuncia o resultado positivo do teste para COVID-19 de Donald Trump,1,https://maldita.es/malditobulo/2020/05/22/resultado-positivo-covid-19-donald-trump/
2062,Assembleia Nacional aprovou a Lei Orgânica de Unidade Solidária e Auxílio Financeiro.,1,http://www.ecuadorchequea.com/las-mentiras-sobre-el-covid-19-en-ecuador/
2063,Mulher com coronavírus caminha nua por uma rua de Guayaquil,1,http://www.ecuadorchequea.com/las-mentiras-sobre-el-covid-19-en-ecuador/
2064,Corporação Nacional de Eletricidade não fará leitura de medidores de luz por conta da emergência sanitária. ,1,http://www.ecuadorchequea.com/las-mentiras-sobre-el-covid-19-en-ecuador/
2065,Todos devem permanecer em casa por 3 ou 4 dias porque os casos positivos de Covid-19 dispararam. ,1,http://www.ecuadorchequea.com/las-mentiras-sobre-el-covid-19-en-ecuador/
2066,Supermaxi dará cupons de US$ 500,1,http://www.ecuadorchequea.com/las-mentiras-sobre-el-covid-19-en-ecuador/
2067,Inscreva-se e receba auxílio alimentação do Plano Social 2020,1,http://www.ecuadorchequea.com/las-mentiras-sobre-el-covid-19-en-ecuador/
2068,Coloquem todos os aparelhos para carregar porque a barragem de Coca Codo Sinclair deixou de operar.,1,http://www.ecuadorchequea.com/las-mentiras-sobre-el-covid-19-en-ecuador/
2069,Castigo de limpeza aos que descumprem o toque de recolher,1,http://www.ecuadorchequea.com/las-mentiras-sobre-el-covid-19-en-ecuador/
2070,"Em duas semanas, Quito atingirá o mesmo nível de contágio de Guayaquil",1,http://www.ecuadorchequea.com/las-mentiras-sobre-el-covid-19-en-ecuador/
2071,Valas comuns em Guayaquil,1,http://www.ecuadorchequea.com/las-mentiras-sobre-el-covid-19-en-ecuador/
2072,"A prefeita de Guayquil, Cynthia Viterí, nunca foi contaminada por COVID-19",1,http://www.ecuadorchequea.com/las-mentiras-sobre-el-covid-19-en-ecuador/
2073,Militares discutem com a Ministra de Governo,1,http://www.ecuadorchequea.com/las-mentiras-sobre-el-covid-19-en-ecuador/
2074,Desabastecimento de alimentos em Guayaquil,1,http://www.ecuadorchequea.com/las-mentiras-sobre-el-covid-19-en-ecuador/
2075,"As doações realizadas para a emergência sanitária serão convertidas em ""crédito tributário"". ",1,http://www.ecuadorchequea.com/las-mentiras-sobre-el-covid-19-en-ecuador/
2076,Os corpos das vítimas da Covid-19 são jogados no mar,1,http://www.ecuadorchequea.com/las-mentiras-sobre-el-covid-19-en-ecuador/
2077,"Rocío González, esposa de Lenín Moreno, integrará a Comissão da Conta de Ajuda Humanitária. ",1,http://www.ecuadorchequea.com/las-mentiras-sobre-el-covid-19-en-ecuador/
2078,Abdala Bucaram (ex-presidente equatoriano) administra a conta nacional de atenção humanitária.,1,http://www.ecuadorchequea.com/las-mentiras-sobre-el-covid-19-en-ecuador/
2079,Folhas de neem curam a COVID19,1,http://www.ecuadorchequea.com/las-mentiras-sobre-el-covid-19-en-ecuador/
2080,Cadáveres de equatorianos chegam à costa do Peru,1,http://www.ecuadorchequea.com/las-mentiras-sobre-el-covid-19-en-ecuador/
2081,"Saques na região de La Ecuatoriana, em Quito",1,http://www.ecuadorchequea.com/las-mentiras-sobre-el-covid-19-en-ecuador/
2082,Tripulantes infectados pela COVID-19 de uma embarcação de Galápagos fogem da quarentena.,1,http://www.ecuadorchequea.com/las-mentiras-sobre-el-covid-19-en-ecuador/
2083,Pescado do Peru é contaminado por águas vindas do Equador.,1,http://www.ecuadorchequea.com/las-mentiras-sobre-el-covid-19-en-ecuador/
2084,O Washington Post publicou que a COVID-19 foi criada em um laboratório chinês. ,1,http://www.ecuadorchequea.com/las-mentiras-sobre-el-covid-19-en-ecuador/
2085,Pais e representantes exigem que o Ministério da Educação adie o início das aulas. ,1,http://www.ecuadorchequea.com/las-mentiras-sobre-el-covid-19-en-ecuador/
2086,Decretado o isolamento total na província de Guayas,1,http://www.ecuadorchequea.com/las-mentiras-sobre-el-covid-19-en-ecuador/
2087,Gargarejos com água e sal evitam reprodução da COVID-19,1,http://www.ecuadorchequea.com/las-mentiras-sobre-el-covid-19-en-ecuador/
2088,O Governo Nacional dispôs destas datas para ativar os setores produtivos. ,1,http://www.ecuadorchequea.com/las-mentiras-sobre-el-covid-19-en-ecuador/
2089,María Paula Romo (ministra do Governo de Equador): Lidamos com vários dados sobre a COVID-19,1,http://www.ecuadorchequea.com/las-mentiras-sobre-el-covid-19-en-ecuador/
2090,"Passar mentolato no nariz e, em seguida, colocar a máscara evitam o contágio pela COVID-19",1,http://www.ecuadorchequea.com/las-mentiras-sobre-el-covid-19-en-ecuador/
2091,"Se atender a esse requisitos, você pode solicitar o bônus Fique em Casa. ",1,http://www.ecuadorchequea.com/las-mentiras-sobre-el-covid-19-en-ecuador/
2092,Roubada a ajuda alimentar em caminhões dos Supermercados TIA,1,http://www.ecuadorchequea.com/las-mentiras-sobre-el-covid-19-en-ecuador/
2093,OMS classifica como incompetente o Governo do Equador diante da pandemia de COVID-19,1,http://www.ecuadorchequea.com/las-mentiras-sobre-el-covid-19-en-ecuador/
2094,Você será contaminado pela COVID-19 apenas por respirar o ar exterior.,1,http://www.ecuadorchequea.com/las-mentiras-sobre-el-covid-19-en-ecuador/
2095,"A COVID-19 é imune a pH alcalino superior a 5,5",1,http://www.ecuadorchequea.com/las-mentiras-sobre-el-covid-19-en-ecuador/
2096,A ozonoterapia é eficaz para combater a COVID-19,1,http://www.ecuadorchequea.com/las-mentiras-sobre-el-covid-19-en-ecuador/
2097,A COVID-19 deve ser tratada como uma trombose,1,http://www.ecuadorchequea.com/las-mentiras-sobre-el-covid-19-en-ecuador/
2098,Há 340.785 casos positivos de COVID-19 no Equador,1,http://www.ecuadorchequea.com/las-mentiras-sobre-el-covid-19-en-ecuador/
2099,O produto mais usado na pandemia de COVID-19 já tem registro sanitário para nosso país. ,1,http://www.ecuadorchequea.com/las-mentiras-sobre-el-covid-19-en-ecuador/
2100,Otto Sonnenholzner renunciou à Vice-Presidência,1,http://www.ecuadorchequea.com/las-mentiras-sobre-el-covid-19-en-ecuador/
2101,12 pessoas morrem na Itália por causa da vacina contra COVID-19,1,http://www.ecuadorchequea.com/las-mentiras-sobre-el-covid-19-en-ecuador/
2102,Nobel afirma que a COVID-19 é artificial,1,http://www.ecuadorchequea.com/las-mentiras-sobre-el-covid-19-en-ecuador/
2103,O uso prolongado de máscaras causa hipóxia,1,http://www.ecuadorchequea.com/las-mentiras-sobre-el-covid-19-en-ecuador/
2104,O Banco Mundial dará bônus de US$ 2.000 a famílias por causa da COVID-19,1,http://www.ecuadorchequea.com/las-mentiras-sobre-el-covid-19-en-ecuador/
2105,FBI prendeu em Boston o professor acusado de criar a COVID-19,1,http://www.ecuadorchequea.com/las-mentiras-sobre-el-covid-19-en-ecuador/
2106,Renunciou Otto Sonnenholzner à Vice-Presidência ,1,http://www.ecuadorchequea.com/las-mentiras-sobre-el-covid-19-en-ecuador/
2107,Circula um link para obter ajuda financeira para a quarentena.,1,http://www.ecuadorchequea.com/las-mentiras-sobre-el-covid-19-en-ecuador/
2108,Abutres devoram cadáveres de vítimas da COVID-19 na Ásia,1,http://www.ecuadorchequea.com/las-mentiras-sobre-el-covid-19-en-ecuador/
2109,Alexandra Ocles será embaixadfora do Equador em Cuba,1,http://www.ecuadorchequea.com/las-mentiras-sobre-el-covid-19-en-ecuador/
2110,Imagem diz que um médico equatoriano morreu seis dias depois de apresentar sintomas de COVID-19,1,http://www.ecuadorchequea.com/las-mentiras-sobre-el-covid-19-en-ecuador/
2111,Financial Times reconhece o trabalho pela queda da curva de mortes em Guayaquil,1,http://www.ecuadorchequea.com/las-mentiras-sobre-el-covid-19-en-ecuador/
2112,A tecnologia 5G funciona como uma arma eletromagnética e a COVID-19 é uma desculpa para que seja instalada em todo o mundo. ,1,http://www.ecuadorchequea.com/las-mentiras-sobre-el-covid-19-en-ecuador/
2113,Até 90 cadáveres são recolhidos diariamente em Quito por causa da COVID-19,1,http://www.ecuadorchequea.com/las-mentiras-sobre-el-covid-19-en-ecuador/
2114,Como gerar renda em casa durante a COVID-19,1,http://www.ecuadorchequea.com/las-mentiras-sobre-el-covid-19-en-ecuador/
2115,Fundação de Bill Gates e de sua esposa Melinda é um centro para reduzir a população,1,http://www.ecuadorchequea.com/las-mentiras-sobre-el-covid-19-en-ecuador/
2116,"Ex-diretora da Secretaría Nacional de Riscos do Equador, Alexandra Ocles: «Se caio, caem todos"". ",1,http://www.ecuadorchequea.com/las-mentiras-sobre-el-covid-19-en-ecuador/
2117,Governo do Equador pediu à CNN a demissão do jornalista Fernando del Rincón,1,http://www.ecuadorchequea.com/las-mentiras-sobre-el-covid-19-en-ecuador/
2118,"Na Itália, finalmente foi descoberta a cura para o coronavírus.",1,http://www.ecuadorchequea.com/las-mentiras-sobre-el-covid-19-en-ecuador/
2119,Vladimir Putin fala no Kremlin sobre a redução da população,1,http://www.ecuadorchequea.com/las-mentiras-sobre-el-covid-19-en-ecuador/
2120,Clube Bildelberg e Bill Gates têm um plano de espalhar a COVID-19 por meio de antenas 5G,1,http://www.ecuadorchequea.com/las-mentiras-sobre-el-covid-19-en-ecuador/
2121,"Venezuela tem a taxa mais baixa de casos de COVID-19 do continente, assegura Jorge Rodríguez, vice-presidente setorial para Comunicação, Cultura e Turismo do país.",1,https://efectococuyo.com/cocuyo-chequea/tasa-casos-continente/
2122,Foto de un periódico de 2003 que fala sobre o atual coronavírus. ,1,https://lasillavacia.com/detector-no-esta-foto-periodico-2003-no-habla-del-coronavirus-actual-76804
2123,Um médico encontrou a cura para a Covid-19,1,https://lasillavacia.com/detector-no-esta-persona-no-encontro-cura-covid-19-76809
2124,Há um cordão sanitário na Cidade da Guatemala,1,https://www.agenciaocote.com/ministerio-de-salud-asegura-que-no-hay-colonias-con-cordon-sanitario-en-ciudad-de-guatemala/
2125,"A. Giammattei, presidente da Guatemala: ""A taxa de letalidade na Guatemala é a terça parte da registrada no resto do mundo"". ",1,https://www.agenciaocote.com/enganoso-a-giammattei-la-tasa-de-letalidad-en-guatemala-es-la-tercera-parte-de-la-del-resto-del-mundo/
2126,"Vídeo mostra uma suposta morte em Chiquimula, Guatemala",1,https://www.agenciaocote.com/el-video-que-muestra-una-supuesta-muerte-en-chiquimula-es-un-simulacro-en-colombia/
2127,É mais seguro fazer uma cesárea durante a pandemia.,1,https://elsurti.com/coronavirus/chequeo/2020/05/22/los-mitos-sobre-nacimientos-en-pandemia/
2128,Uma mãe com COVID-19 não pode amamentar seu bebê.,1,https://elsurti.com/coronavirus/chequeo/2020/05/22/los-mitos-sobre-nacimientos-en-pandemia/
2129,"Guillermo Sequera (diretor de Vigilância Sanitária no Paraguai): ""Devemos nos contagiar. A meta é adoecermos pouco a pouco"" ",1,https://elsurti.com/chequeo/2020/05/18/la-evidencia-sobre-una-vacuna-social-aun-es-limitada/
2130,"Eduardo Petta (ministro da Educação do Paraguai): ""A estratégia de aprendizagem das plataformas virtuais no Paraguai é gratuita; em outras países, não. ",1,https://elsurti.com/coronavirus/chequeo/2020/05/21/paraguay-no-es-el-unico-pais-donde-la-plataforma-de-aprendizaje-virtual-es-gratis/
2131,O uso prolongado da máscara causa hipóxia. ,1,https://boliviaverifica.bo/el-uso-prolongado-de-barbijo-no-produce-hipoxia/
2132,"O coronavírus se multiplica em águas residuais. Por conta disso, água sanitária deve ser despejada nas tubulações. ",1,https://www.Newtral/el-coronavirus-no-se-multiplica-en-aguas-residuales-y-echar-lejia-por-las-canalizaciones-afectaria-a-las-investigaciones-cientificas/20200524/
2133,O uso de máscaras causa hipóxia. ,1,https://www.Newtral/el-uso-de-mascarillas-no-produce-hipoxia/20200521/
2134,"Itália descobriu a cura para o coronavírus, que é uma doença causada por uma bactéria potencializada pela rede 5G. ",1,https://www.Newtral/ni-italia-ha-descubierto-la-cura-para-el-coronavirus-ni-la-enfermedad-es-una-bacteria-amplificada-por-5g/20200522/
2135,"Axel Kicillof (governador da Província de Buenos Aires): com 80 dias após o primeiro caso, a Argentina tem 10 mil casos; Chile, 60 mil e Brasil, 200 mil. ",1,https://chequeado.com/ultimas-noticias/kicillof-a-los-80-dias-desde-el-primer-caso-la-argentina-tiene-10-mil-casos-chile-60-mil-y-brasil-200-mil/
2136,"A imagem de uma antena em forma de cactos, indicando que é uma antena  5G e que elas são escondidas para que ""as pessoas não percebam que são radioativas e emitem ondas de frequência eletromagnética"". ",1,https://maldita.es/malditobulo/2020/05/23/antena-forma-cactus-5g-coronavirus/
2138,"Axel Kicillof (governador da Província de Buenos Aires): “Na cidade de Buenos Aires, metade dos trabalhadores são da Província"". ",1,https://chequeado.com/ultimas-noticias/kicillof-en-la-ciudad-la-mitad-de-los-trabajadores-son-de-la-provincia/
2144,O Washington Post confirmou que o paciente zero de COVID-19 trabalhava em laboratório de Wuhan,1,https://larepublica.pe/verificador/2020/05/21/washington-post-es-falso-que-medio-de-estados-unidos-confirmo-que-paciente-cero-de-covid-19-trabajaba-en-laboratorio-de-wuhan//
2145,O Ministério da Saúde da Guatemala busca doadores de sangue,1,https://www.agenciaocote.com/si-el-ministerio-de-salud-busca-donantes-de-sangre/
2149,Coronavírus: conheça as correntes com informações falsas que circulam pelo WhatsApp,1,https://politica.estadao.com.br/blogs/estadao-verifica/coronavirus-veja-correntes-com-informacoes-falsas-que-circulam-no-whatsapp/#Versao_em_espanhol
2150,Decretado “feriado nacional” de sete dias no Brasil,1,https://politica.estadao.com.br/blogs/estadao-verifica/coronavirus-decreto-de-feriado-nacional-de-sete-dias-e-pegadinha/#Versao_em_espanhol
2151,Postagens de uma profecia de Nostradamus sobre a pandemia,1,https://politica.estadao.com.br/blogs/estadao-verifica/coronavirus-postagens-inventam-profecia-de-nostradamus-sobre-pandemia/#Versao_em_espanhol
2152,Uma corrente de mensagens traz informações sobre as características do novo coronavírus e da doença. ,1,https://politica.estadao.com.br/blogs/estadao-verifica/coronavirus-fiocruz-alerta-para-mensagem-falsa-que-circula-no-whatsapp/#Versao_em_espanhol
2153,Imagem de um envelope de um saque de R$ 470 do Bolsa Família,1,https://politica.estadao.com.br/blogs/estadao-verifica/coronavirus-mensagem-sobre-saque-de-r-470-do-bolsa-familia-e-falsa/#Versao_em_espanhol
2154,O diretor do Hospital das Clínicas (HC) recomendou tomar chá de erva doce e comer fígado de vaca para evitar a contaminação pelo novo coronavírus. ,1,https://politica.estadao.com.br/blogs/estadao-verifica/coronavirus-corrente-de-whatsapp-dissemina-informacoes-falsas-sobre-prevencao/#Versao_em_espanhol
2155,Ambev suspende a produção de cerveja por causa da pandemia,1,https://politica.estadao.com.br/blogs/estadao-verifica/coronavirus-ambev-desmente-suspensao-de-producao-de-cerveja-por-pandemia/#Versao_em_espanhol
2156,Áudio enviado por WhatsApp exagera o número de casos no hospital Prevent Senior,1,https://politica.estadao.com.br/blogs/estadao-verifica/coronavirus-audio-exagera-numero-de-casos-na-prevent-senior/#Versao_em_espanhol
2157,O novo coronavírus foi planejado pela China por questões econômicas. ,1,https://politica.estadao.com.br/blogs/estadao-verifica/boato-no-facebook-inventa-que-novo-coronavirus-foi-planejado-pela-china/#Versao_em_espanhol
2158,Quem dirigir sem máscara poderá ser multado ,1,https://www.aosfatos.org/noticias/es-falso-que-quien-conduzca-sin-mascara-de-proteccion-podran-aplicarle-una-multa-de-transito/
2159,Foto que mostra a deputada federal brasileira Maria do Rosário costurando uma máscara sem linha,1,https://www.aosfatos.org/noticias/es-falso-que-una-foto-muestra-la-diputada-federal-maria-do-rosario-cosiendo-mascaras-sin-hilo/
2160,Médicos cubanos são enviados ao AM para conter a COVID-19,1,https://www.aosfatos.org/noticias/medicos-cubanos-en-foto-de-2013-no-son-profesionales-enviados-am-para-contener-la-covid-19/
2161,"O número de mortes por COVID-19 no Amazonas caiu, depois da visita do ministro da Saúde, Nelson Teich",1,https://www.aosfatos.org/noticias/el-numero-de-muertes-por-covid-19-en-amazonas-no-fue-menor-despues-de-la-visita-de-teich/
2162,Caixões foram enterrados contendo pedras e madeira em Belo Horizonte. ,1,https://www.aosfatos.org/noticias/es-falso-que-se-enterraron-cajones-con-piedras-y-madera-en-belo-horizonte/
2163,"Ismael Reyes, candidato presidencial do Partido Democrata Institucional: “Presidente Medina não acha que do orçamento de 980 milhões de pesos sob sua administração, você pode usar parte desse dinheiro para pagar testes de coronavírus nos laboratórios?"",""Falso",1,Outros
2172,As pessoas receberão uma pulseira amarela fora de casa durante a quarentena.,1,https://spondeomedia.com/falso-pondran-pulsera-amarilla-a-personas-fuera-de-casa-durante-cuarentena/
2173,Tomar café ajuda a combater o coronavírus,1,https://spondeomedia.com/falso-tomar-cafe-ayuda-a-combatir-el-coronavirus/
2174,Alimentos com alto pH combatem o coronavírus,1,https://spondeomedia.com/falso-alimentos-con-alto-ph-contrarrestan-el-coronavirus/
2175,Itália obteve a cura definitiva da doença causada pelo coronavírus e isto se deve ao suposto descobrimento de sua verdadeira natureza: coagulação intravascular disseminada. ,1,https://ojo-publico.com/1824/es-falsa-la-version-de-que-italia-encontro-cura-para-la-covid-19
2176,Beber agua do mar evita o desenvolvimento da COVID-19,1,https://ojo-publico.com/1823/beber-agua-de-mar-no-evita-el-contagio-del-coronavirus
2177,Um poema escrito durante a epidemia de peste de 1800,1," em 16 de março. """
2178,"Imagens de um protesto em Villa Azul, Argentina, contra a quarentena",1,https://chequeado.com/el-explicador/no-esta-protesta-no-fue-en-villa-azul-argentina-sino-en-chile/
2179,Vídeo mostra a polícia disparando contra frequentadores da praia durante a pandemia de COVID-19,1,https://piaui.folha.uol.com.br/lupa/2020/04/15/verificamos-praia-policia-coronavirus/
2180,"Vídeo de médica alemã sobre ""a verdade do coronavírus"". ",1,https://larepublica.pe/verificador/2020/05/22/video-de-doctora-alemana-sobre-la-verdad-el-coronavirus-contiene-afirmaciones-falsas/
2181,O Ministério da Saúde aprovou um protocolo para o tratamento da COVID-19,1,https://larepublica.pe/verificador/2020/05/20/coronavirus-minsa-es-verdad-que-el-ministerio-de-salud-aprobo-un-protocolo-para-el-tratamiento-de-la-covid-19/
2182,Despejar uma xícara de água sanitária no vaso sanitário e na pia previne o contágio da COVID-19,1,https://larepublica.pe/verificador/2020/05/24/peru-coronavirus-lejia-es-falso-que-echar-una-taza-de-lejia-al-inodoro-y-al-lavadero-previene-el-contagio-por-la-covid-19/
2183,Inteligência alemã disse que a China e a Organização Mundial de Saúde (OMS) “ocultaram” informações sobre o coronavírus. ,1,https://larepublica.pe/verificador/2020/05/20/es-falso-que-la-oms-y-xi-jinping-acordaron-ocultar-informacion-acerca-del-coronavirus/
2184,O enxague bucal mata o coronavírus,1,https://larepublica.pe/verificador/2020/05/19/coronavirus-es-falso-que-el-enjuague-bucal-mata-el-coronavirus/
2185,"Fotografia de cadáveres em um necrotério, tirada na Espanha durante a pandemia. ",1,https://larepublica.pe/verificador/2020/05/17/coronavirus-espana-es-falso-que-fotografia-de-fallecidos-en-una-morgue-fue-tomada-en-espana-durante-la-pandemia/
2186,"Bebida feita à base de kion, alho, cebola e limão acaba com a COVID-19",1,https://larepublica.pe/verificador/2020/05/16/coronavirus-peru-es-falso-que-bebida-hecha-a-base-de-kion-ajo-cebolla-y-limon-acaba-con-la-covid-19/
2187,Comunicado do Ministério da Saúde do Peru recomendando remédios caseiros para combater a COVID-19,1,https://larepublica.pe/verificador/2020/05/16/coronavirus-whatsapp-comunicado-de-las-autoridades-que-recomienda-remedios-caseros-para-combatir-la-covid-19-es-falso/
2188,"O limão, o alho, a cebola, e o kión contêm Azitromicina",1,https://larepublica.pe/verificador/2020/05/15/azitromicina-es-falso-que-el-limon-el-ajo-la-cebolla-y-el-kion-contengan-ese-medicamento/
2189,"Vídeo no qual uma mulher duvida ser benéfico um método para aumento de imunidade financiado pelo fundador de Microsoft, Bill Gates",1,https://larepublica.pe/verificador/2020/05/14/bill-gates-video-sobre-la-vacuna-del-cofundador-de-microsoft-es-falso/
2190,A automedicação com 4 remédios diferentes trata a COVID-19,1,https://larepublica.pe/verificador/2020/05/13/coronavirus-peru-facebook-es-falso-que-la-automedicacion-con-4-farmacos-diferentes-trata-la-covid-19/
2191,Tomar três aspirinas com limão e mel cura o novo coronavírus. ,1,https://larepublica.pe/verificador/2020/05/12/coronavirus-peru-facebook-es-falso-que-tomar-3-aspirinas-con-limon-y-miel-cura-el-nuevo-coronavirus/
2192,A Fundação Gates é um centro para redução global da população. ,1,https://larepublica.pe/verificador/2020/05/18/bill-gates-es-falso-que-la-fundacion-gates-sea-un-centro-para-la-reduccion-global-de-la-poblacion-humana/
2193,Colômbia ocupa o primeiro lugar em corrupção em plena pandemia. ,1,https://colombiacheck.com/chequeos/no-colombia-no-ocupa-el-primer-lugar-en-corrupcion-en-plena-pandemia
2194,A Organização Mundial de Saúde (OMS) disse que a Colômbia é o país mais organizado em termos de prevenção do coronavírus na América e o segundo em todo o mundo. ,1,https://colombiacheck.com/chequeos/oms-no-ha-dicho-que-colombia-es-el-pais-mas-organizado-en-la-prevencion-del-coronavirus-en
2195,"Não se deve temer a crise econômica desencadeada pela COVID-19 porque os picos de crescimento econômico atingidos pela cidade de Manizales foram alcançados depois das duas guerras mundiais, segundo o prefeito de Manizales, Carlos Mario Marín",1,https://colombiacheck.com/chequeos/manizales-no-tuvo-sus-picos-de-desarrollo-mas-altos-tras-guerras-mundiales
2196,Imagem da prefeita de Socorro (Colômbia) presa por manipulação de contratos em meio à pandemia. ,1,https://colombiacheck.com/chequeos/foto-de-alcaldesa-del-socorro-capturada-es-falsa
2197,Imagem de uma enfermeira agredida na Colômbia,1,https://colombiacheck.com/chequeos/caso-de-enfermera-agredida-ocurrio-realmente-en-mexico
2198,Beber e fazer vaporizações com água do mar previne a COVID-19,1,https://animal.mx/2020/05/falso-agua-de-mar-covid-19/
2199,Injeções de água do mar previnem e curam a COVID-19,1,https://www.animalpolitico.com/elsabueso/falso-inyecciones-agua-de-mar-covid-19/
2200,"Funcionários mexicanos lavam frango com cloro e Ace, colocando em risco de envenenamento a população. ",1,https://www.animalpolitico.com/elsabueso/sacado-de-contexto-lavan-pollo-cloro/
2201,O Adrenocromo provoca a morte de pessoas por coronavírus. ,1,https://animal.mx/2020/05/adrenocromo-para-que-sirve-falso-covid-19/
2202,A azitromicina cura o coronavírus e é um composto natural presente em alguns alimentos. ,1,https://www.animalpolitico.com/elsabueso/azitromicina-covid-19-compuesto-natural/
2203,"Vídeo de um homem, no México, que desmaia por causa da COVID-19 ",1,https://www.animalpolitico.com/elsabueso/video-hombre-desmayo-colombia-mexico/
2204,"Imagem de 3 crianças de muletas, sequela da vacinação de Bill Gates",1,https://www.animalpolitico.com/elsabueso/ninos-vacunados-bill-gates/
2205,Está provado que a hidroxicloroquina e a azitromicina matam a COVID-19,1,https://www.animalpolitico.com/elsabueso/falso-hidroxicloriquina-azitromicina-covid-19/
2206,"Imagem de um hospital em Chiapas, México",1,https://www.animalpolitico.com/elsabueso/fotografia-no-es-hospital-chiapas/
2207,"Os vírus patógenos não existem, demonstrou judicialmente o biólogo alemão Stefan Lanka",1,https://animal.mx/2020/05/virus-no-existe-noticia-falsa-stefan-lanka-medicina-germanica/
2208,Clarín publicou um artigo em 2003  sobre a COVID-19,1,https://www.animalpolitico.com/elsabueso/clarin-articulo-2003-coronavirus-no-covid-19/
2209,Amazon está distribuindo cestas básicas por conta da COVID-19,1,https://efectococuyo.com/cocuyo-chequea/amazon-no-reparte-ayudas-alimentarias/
2213,A COVID-19 pode ser tratada com antibióticos,1,https://www.aosfatos.org/noticias/no-es-verdad-que-la-covid-19-pueda-tratarse-con-antibioticos/
2214,O número de mortes por COVID-19 diminuiu em Manaus logo depois da visita do ministro da Saúde. ,1,https://www.aosfatos.org/noticias/es-falso-que-el-numero-de-muertes-por-covid-19-disminuyo-en-manaos-luego-de-la-visita-del-ministro-de-salud/
2215,Médico encontrou a cura para a COVID-19,1,https://larepublica.pe/verificador/2020/05/26/coronavirus-es-falso-que-cura-de-la-covid-19-haya-sido-encontrada-por-medico-boliviano-alejandro-unzueta/
2216,O dióxido de cloro (cds) é a cura para a COVID-19,1,https://larepublica.pe/verificador/2020/05/26/coronavirus-es-falso-que-el-dioxido-de-cloro-cds-es-la-cura-para-la-covid-19/
2217,"Na Bolívia, estão distribuindo ivermectina casa por casa para conter a COVID-19",1,https://larepublica.pe/verificador/2020/05/27/ivermectina-coronavirus-es-enganoso-que-en-bolivia-esten-repartiendo-ivermectina-casa-por-casa-para-frenar-la-covid-19/
